{
  "schemaVersion": 1,
  "contractId": "logical-git-transaction",
  "authenticatedAgent": 7,
  "publicationSlot": 3,
  "operation": "create",
  "refName": "refs/heads/agents/agent-7/evidence",
  "oldOid": "0000000000000000000000000000000000000000000000000000000000000000",
  "newOid": "1111111111111111111111111111111111111111111111111111111111111111",
  "slotStartJournalDigest": "aaaaaaaaaaaaaaaaaaaaaaaaaaaaaaaaaaaaaaaaaaaaaaaaaaaaaaaaaaaaaaaa",
  "objects": []
}
